{
  "schema_version": "runsteward.worktree-lease/v1",
  "lease_id": "lease:atomic-full-codex-01:2",
  "run_id": "run:atomic-full-codex-01",
  "task_id": "task:atomic-full-codex-01",
  "lease_epoch": 2,
  "purpose": "resume",
  "status": "released",
  "repository_id": "runsteward",
  "original_source_head": "a0a0a0a0a0a0a0a0a0a0a0a0a0a0a0a0a0a0a0a0",
  "observed_head": "a0a0a0a0a0a0a0a0a0a0a0a0a0a0a0a0a0a0a0a0",
  "branch_name": "feature/runsteward-contracts-core",
  "worktree": {
    "path": "C:\\lifecycle\\worktrees\\contracts-core",
    "collision_key": "fs:win32:3333333333333333333333333333333333333333333333333333333333333333"
  },
  "state_path": {
    "path": "C:\\runsteward\\state\\run-atomic-01",
    "collision_key": "fs:win32:1111111111111111111111111111111111111111111111111111111111111111"
  },
  "evidence_path": {
    "path": "C:\\runsteward\\evidence\\run-atomic-01",
    "collision_key": "fs:win32:2222222222222222222222222222222222222222222222222222222222222222"
  },
  "lock_path": {
    "path": "C:\\runsteward\\locks\\run-atomic-01.lock",
    "collision_key": "fs:win32:7777777777777777777777777777777777777777777777777777777777777777"
  },
  "owner": {
    "executor_id": "rw1-test-executor",
    "process_session_ref": "sha256:8888888888888888888888888888888888888888888888888888888888888888",
    "host_fingerprint": "sha256:9999999999999999999999999999999999999999999999999999999999999999"
  },
  "acquired_at": "2026-07-14T00:05:00Z",
  "last_heartbeat_at": "2026-07-14T00:05:30Z",
  "expires_at": "2026-07-14T00:10:30Z",
  "previous_lease_ref": {
    "ref": "contracts/fixtures/scenarios/lease.atomic-full-codex-01.epoch1.released.json",
    "digest": "sha256:035605464035a4633aa3eb851a2b569ea1f9303a5527663a4e57c9429c3fc88d"
  },
  "previous_lease_id": "lease:atomic-full-codex-01:1",
  "release_reason": "The execution attempt released its local lease before reporting or resuming.",
  "lease_digest": "sha256:7420385d3e84291ce27c754abb3110d4b17c439cfa718ee0294cc2e6adff2f4b"
}
